http://www.nytimes.com/2011/01/11/us/11winters.html	Richard Winters, 92; Led 'Band of Brothers'	Richard Winters, the commanding officer of Easy Company, the Army unit whose gritty combat from the beaches of Normandy to the capture of Hitler's mountain retreat was recounted in the book and television series ''Band of Brothers,'' died Jan. 2 in Campbelltown, Pa. He was 92 and lived in Hershey, Pa. His death was confirmed by Nikki Soliday,
http://query.nytimes.com/gst/fullpage.html?res=9C07E0D7113AF933A25752C0A9679D8B63	Paul Soldner, 89, Ceramic Artist and Innovator	Paul Soldner, a ceramist who put his own twist on the Japanese firing technique known as raku to create wildly spontaneous sculptural vessels, died on Monday at his home in Claremont, Calif. He was 89. His death was confirmed by his daughter, Stephanie Soldner Sullivan. Mr. Soldner was the first student of Peter Voulkos, the revolutionary founder
http://www.nytimes.com/2011/01/10/science/10reiss.html	Louise Reiss, 90; Helped Ban Atomic Testing	Dr. Louise Reiss, who directed a study that examined hundreds of thousands of baby teeth during the cold war and helped persuade the world's leading powers to ban nuclear testing in the atmosphere, died Jan. 1 at her home in Pinecrest, Fla. She was 90. Her son, Eric, confirmed her death. Dr. Reiss and her husband, Eric, both physicians, were
http://query.nytimes.com/gst/fullpage.html?res=9803E5DE173DF933A25752C0A9679D8B63	Jiri Dienstbier, Czech Dissident, Is Dead at 73	Jiri Dienstbier, one of Eastern Europe's leading dissidents, who with Vaclav Havel helped topple Communism in Czechoslovakia, died Saturday in Prague. He was 73. His death was announced by Czech state television. The cause was not specified. Mr. Dienstbier's death marked the passing of a journalist, raconteur, strategist and politician whose life
http://query.nytimes.com/gst/fullpage.html?res=9A01E3D8143DF93AA35752C0A9679D8B63	Cyril Harris Dies at 93; Fine-Tuned Concert Halls	Cyril M. Harris, an acoustical engineer responsible for the sound in many of the most prominent concert halls, theaters and auditoriums in the United States, including the Metropolitan Opera and Avery Fisher Hall in New York, died on Tuesday at his home in Manhattan. He was 93. His death was confirmed by his daughter, Kate. Mr. Harris was a
http://www.nytimes.com/2011/01/09/style/08vass.html	Joan Vass, 85, Designer Of Elegant Knitwear Line	Joan Vass, a popular knitwear designer in the 1980s and '90s whose elegantly understated sweaters stood in contrast to her reputation as a bohemian and a provocateur, died on Thursday at her home in Manhattan. She was 85. Ms. Vass died in her sleep, her daughter, Sara Vass, said. Before starting her signature fashion label in the mid-1970s, Ms.
http://www.nytimes.com/2011/01/09/arts/music/09harris.html	Cyril Harris Dies at 93; Fine-Tuned Concert Halls	Cyril M. Harris, an acoustical engineer responsible for the sound in many of the most prominent concert halls, theaters and auditoriums in the United States, including the Metropolitan Opera and Avery Fisher Hall in New York, died on Tuesday at his home in Manhattan. He was 93. His death was confirmed by his daughter, Kate. Mr. Harris was a
http://www.nytimes.com/2011/01/09/arts/design/09ngwenya.html	Malangatana Ngwenya, 74, Mozambican Painter	Malangatana Ngwenya, one of Africa's best-known contemporary artists, whose phantasmagoric paintings were inspired by political conditions in his home country, Mozambique, died on Wednesday in Matosinhos, Portugal. He was 74. The Pedro Hispano Hospital said he had been admitted on Christmas Day after he became ill while visiting his daughter, but
http://www.nytimes.com/2011/01/08/world/asia/08vangpao.html	Gen. Vang Pao, Laotian Who Aided U.S., Dies at 81	Vang Pao, a charismatic Laotian general who commanded a secret army of his mountain people in a long, losing campaign against Communist insurgents, then achieved almost kinglike status as their leader-in-exile in the United States, died Thursday in Clovis, Calif. He was 81. His death was confirmed by Michael Bailey, a spokesman for the Clovis
http://www.nytimes.com/2011/01/08/books/08smith.html	Dick King-Smith, 88, Author; His Novel Inspired 'Babe'	LONDON (AP) -- Dick King-Smith, whose children's novel ''The Sheep-Pig'' inspired the hit 1995 movie ''Babe,'' died Tuesday at his home near Bath. He was 88. His publisher, Random House Children's Books, said he had been in poor health in recent years. Mr. King-Smith worked for 20 years as a farmer before he trained as a primary school teacher. In
http://www.nytimes.com/2011/01/08/us/politics/08weaver.html	A. Vernon Weaver Jr., 88; Led S.B.A.	MIAMI A. Vernon Weaver Jr., an Arkansas businessman who led the Small Business Administration under President Jimmy Carter and was the ambassador to the European Union under President Bill Clinton, died here on Dec. 28. He was 88. His death was confirmed by his wife, Joyce Weaver. The couple had lived in South Florida. Mr. Carter, who met Mr.
http://www.nytimes.com/2011/01/08/sports/08duren.html	Ryne Duren, 81, Pitcher; Made Batters Nervous	Ryne Duren, the star relief pitcher for two Yankee World Series teams who stared down batters through thick-lensed eyeglasses and then delivered fastballs that might go just about anywhere, died Thursday at his home in Lake Wales, Fla. He was 81. His death was announced by his stepson Mark Jackson, The Associated Press said. Pitching for the
http://www.nytimes.com/2011/01/07/nyregion/07trager.html	David G. Trager, 73, Judge in Crown Heights Case, Dies	David G. Trager, a federal judge in Brooklyn whose rulings were pivotal in a racially charged case in Crown Heights and in the first civil suit to challenge the Bush administration's practice of sending terrorism suspects to countries that employ torture, died on Wednesday at his home in Brooklyn. He was 73. The cause was pancreatic cancer, his
http://query.nytimes.com/gst/fullpage.html?res=9400E4DF143AF934A35752C0A9679D8B63	Raphael Hillyer, 96, Founding Violist of Juilliard Quartet	Raphael Hillyer, the founding violist of the Juilliard String Quartet and a soloist and teacher known for the warmth and expressivity of his tone, died on Dec. 27 in Boston, where he lived. He was 96. The cause was heart failure, said his daughter Reiko Hillyer. Mr. Hillyer was the last of the original members of the Juilliard String Quartet to
http://query.nytimes.com/gst/fullpage.html?res=9804E6D6133AF934A35752C0A9679D8B63	David G. Trager, 73, Judge in Crown Heights Case, Dies	David G. Trager, a federal judge in Brooklyn whose rulings were pivotal in a racially charged case in Crown Heights and in the first civil suit to challenge the Bush administration's practice of sending terrorism suspects to countries that employ torture, died on Wednesday at his home in Brooklyn. He was 73. The cause was pancreatic cancer, his
http://www.nytimes.com/2011/01/07/arts/television/07stevenson.html	Margot Stevenson, 98, Prolific Broadway Actress	Margot Stevenson, a stage actress for more than six decades who appeared on Broadway in Kaufman and Hart's ''You Can't Take It With You'' in the 1930s and opposite Orson Welles in the radio series ''The Shadow,'' died on Sunday at her home in Manhattan. She was 98. The death was confirmed by her daughter, Margot Avery. Ms. Stevenson was, in the
http://query.nytimes.com/gst/fullpage.html?res=9E07E1D8113BF934A35752C0A9679D8B63	Raphael Hillyer, Founding Violist of Juilliard Quartet, Dies at 96	Raphael Hillyer, the founding violist of the Juilliard String Quartet and a soloist and teacher known for the warmth and expressivity of his tone, died on Dec. 27 in Boston, where he lived. He was 96. The cause was heart failure, said his daughter Reiko Hillyer. Mr. Hillyer was the last of the original members of the Juilliard String Quartet to
http://www.nytimes.com/2011/01/07/nyregion/07harries.html	Brenton Harries, 82; Warned of '75 Fiscal Crisis	Brenton W. Harries, the Standard & Poor's president whose public alarm over New York's ballooning debt foreshadowed the city's 1975 fiscal crisis, died Dec. 26 in Poinciana, Fla., where he had retired. He was 82. His death was confirmed by his son Bradford. On April 2, 1975, Standard & Poor's suspended its A rating, the third-highest, of New York
http://www.nytimes.com/2011/01/07/business/07tyson.html	Donald J. Tyson, Who Turned Chicken Into a Global Business, Is Dead at 80	Donald J. Tyson, an aggressive and visionary entrepreneur who dropped out of college and built his father's Arkansas chicken business into the behemoth Tyson Foods, one of the world's largest producers of poultry, beef and pork, died on Thursday. He was 80 and lived in Fayetteville, Ark. The cause was complications of cancer, Tyson Foods said.
http://www.nytimes.com/2011/01/07/nyregion/07bonilla.html	Frank Bonilla, 85, Founder Of Puerto Rican Study Center	Frank Bonilla, an academic who grew up in two of New York's poorest neighborhoods, faced segregation in the Midwest and went on to create one of the nation's first college-level Puerto Rican studies programs and its first consortium for Latino studies, died on Dec. 28 in Escondido, Calif. He was 85. His daughter Natasha Bonilla Martinez confirmed
http://www.nytimes.com/2011/01/06/us/politics/06weaver.html	A. Vernon Weaver Jr., Ex-Carter Official, Dies at 88	MIAMI (AP) -- A. Vernon Weaver Jr., an Arkansas businessman who led the Small Business Administration under President Jimmy Carter and was the ambassador to the European Union under President Bill Clinton, died here on Dec. 28. He was 88. His death was confirmed by his wife, Joyce Weaver. The couple had lived in South Florida. Mr. Carter, who met
http://query.nytimes.com/gst/fullpage.html?res=9400E2DD113BF935A35752C0A9679D8B63	Ab Simon, 88, Is Dead; Led Seagram's Wine Unit	Ab Simon, who as the longtime chairman of the Seagram Chateau & Estate Wines Company was a commanding figure in the American wine trade and a leading importer of fine Bordeaux to the United States, died on Saturday at his home in Manhattan. He was 88. The cause was complications of heart disease, his wife, Francine, said. Mr. Simon, an Iraqi who
http://www.nytimes.com/2011/01/06/arts/music/06karn.html	Mick Karn, 52, Rock Bassist	LONDON (AP) -- Mick Karn, an influential rock bassist best known for his work in the group Japan, died on Tuesday at his home here. He was 52. The cause was cancer, a statement on his Web site said. Mr. Karn announced last year that he had advanced-stage cancer. Mr. Karn and two friends, David Sylvian and Steve Jansen, formed Japan in 1974. Mr.
http://www.nytimes.com/2011/01/06/nyregion/06ratchford.html	William R. Ratchford, 76, Connecticut Congressman	HARTFORD (AP) -- William R. Ratchford, a former three-term Connecticut congressman who later served in the Clinton administration, died on Sunday in Arlington, Va., where he had lived for many years. He was 76. The cause was complications of Parkinson's disease, his wife, Barbara, said. Mr. Ratchford, a Democrat, served six terms in the Connecticut
http://www.nytimes.com/2011/01/06/world/asia/06zorthian.html	Barry Zorthian, 90, U.S. Diplomat, Dies	Barry Zorthian, who as an American diplomat in Vietnam orchestrated a psychological warfare campaign while serving as his country's principal spokesman in Saigon, sparring with a new generation of skeptical journalists in briefings that came to be known as the ''five o'clock follies,'' died on Dec. 30 in Washington. He was 90. The cause was a staph
http://www.nytimes.com/2011/01/05/theater/05haworth.html	Jill Haworth, Original Sally In 'Cabaret,' Dies at 65	Jill Haworth, a British-born film ingnue in the 1960s who made her only Broadway appearance as the original Sally Bowles in ''Cabaret,'' died Monday at her home in Manhattan. She was 65. The police confirmed her death, attributing it to natural causes. A petite, strikingly pretty blonde (she wore a dark wig on Broadway), Ms. Haworth was just 14
http://www.nytimes.com/2011/01/05/arts/music/05rafferty.html	Gerry Rafferty, Songwriter, Dies at 63	Gerry Rafferty, a Scottish singer and songwriter who combined a gift for melody, a distinctive voice and a fatalistic worldview to produce 1970s hits like ''Stuck in the Middle With You'' and ''Baker Street,'' died Tuesday in Dorset, England. He was 63. His death was confirmed by Michael Gray, his former manager, in an obituary he wrote for the
http://query.nytimes.com/gst/fullpage.html?res=9C00EEDC1F38F936A35752C0A9679D8B63	Hideko Takamine, 86, Acclaimed Actress	Hideko Takamine, a Japanese actress who over the course of nearly 200 films developed from an endearing child star into a powerful representative of the Japanese woman's search for identity and autonomy in the years after World War II, died on Dec. 28 in Tokyo. She was 86. The cause was lung cancer, a spokesman said. Ms. Takamine, who often seemed
http://query.nytimes.com/gst/fullpage.html?res=9903E1DE153BF936A35752C0A9679D8B63	Bill Erwin, 96, Character Actor and 'Grump'	LOS ANGELES (AP) -- Bill Erwin, a character actor whose long movie and television career included a memorable role as a grumpy old man on ''Seinfeld,'' died on Dec. 29 at his home here. He was 96. His death was confirmed by his son Mike. Mr. Erwin's Hollywood career began with a small part in the Jimmy Durante-Phil Silvers comedy ''You're in the
http://www.nytimes.com/2011/01/04/arts/04francis.html	Anne Francis, 80, TV and Film Actress	LOS ANGELES (AP) -- Anne Francis, who was best known for her roles in the 1950s science-fiction film ''Forbidden Planet'' and the 1960s television series ''Honey West,'' died on Sunday in Santa Barbara, Calif. She was 80. The cause was complications of pancreatic cancer, her daughter Jane Uemura told The Los Angeles Times. Ms. Francis had surgery
http://www.nytimes.com/2011/01/04/arts/04postlethwaite.html	Pete Postlethwaite, an Actor With Broad Range, Dies at 64	Pete Postlethwaite, a lanky, craggy-faced character actor whose range stretched from sweet sentimentality to acid menace and who was nominated for an Academy Award in 1994 for his role as the father of a man unjustly accused of terrorism in ''In the Name of the Father,'' died on Sunday in Shrewsbury, Shropshire, England. He was 64 and lived on a
http://www.nytimes.com/2011/01/03/arts/03vega.html	Janine Pommy Vega, Restless Poet, Dies at 68	Janine Pommy Vega, a poet and intimate of the Beat generation luminaries Allen Ginsberg and Peter Orlovsky whose lifelong quest for transcendence took her to San Francisco in the 1960s and ona pilgrimage to neolithic goddess-worship sites in the 1980s, died on Dec. 23 at her home in Willow, N.Y. She was 68. The cause was a heart attack, her
http://www.nytimes.com/2011/01/03/world/asia/03szeto.html	Szeto Wah, 79, Political Activist in Hong Kong	HONG KONG -- Szeto Wah, a Hong Kong union leader and critic of British colonial rule who became an implacable critic of the Chinese Communist Party after the Tiananmen Square killings in 1989, died on Sunday after a long struggle with lung cancer. He was 79. A spokeswoman for the Prince of Wales Hospital here confirmed his death by phone and said
http://www.nytimes.com/2011/01/02/us/02romay.html	Lina Romay, 91, Entertainer	PASADENA, Calif. (AP) -- Lina Romay, who sang with the Xavier Cugat orchestra in the early 1940s before beginning a 15-year career as a film and television actress, died here on Dec. 17. She was 91. Her death was confirmed by her son, Jay Gould. The daughter of a Mexican diplomat, Ms. Romay was born in Brooklyn in 1919 and began her entertainment
http://www.nytimes.com/2011/01/02/world/02weiss.html	Arnold Weiss Dies at 86; Helped to Find Hitler's Will	Arnold Hans Weiss, who fled to the United States from Nazi Germany as a 13-year-old and returned as an American soldier during World War II, becoming a principal in the investigation that led to the discovery of Hitler's last will and political testament, died Dec. 7 in Rockville, Md. He was 86 and lived in Chevy Chase, Md. The cause was pneumonia,
http://query.nytimes.com/gst/fullpage.html?res=9C05E1DC1038F931A35752C0A9679D8B63	Ruth Park, 93, Australian Realist Author	Ruth Park, whose novel of the Sydney slums, ''The Harp in the South,'' shocked Australians in the 1940s but did not prevent her from becoming one of the country's most revered writers, died on Dec. 14 in Sydney. She was 93. Her death was confirmed by her daughter Deborah Niland. Ms. Park leapt from obscurity in 1946 when her unpublished first
http://query.nytimes.com/gst/fullpage.html?res=9E0DE3D91130F931A35752C0A9679D8B63	Justice Steven W. Fisher, 64	Steven W. Fisher, a New York State justice who presided over the trial of two men who killed five employees of a Wendy's fast food restaurant in Queens in 2000, died on Dec. 18 at his home in Queens. He was 64. The cause was lung cancer, his son-in-law, David Kerpen, said. Justice Fisher was the last New York State judge to impose the death
http://www.nytimes.com/2011/01/01/us/01milliken.html	Roger Milliken, 95, Conservative Tycoon	Roger Milliken, a South Carolina textile magnate who supported conservative causes and was instrumental in building the state into a bastion of the Republican Party, died Thursday in Spartanburg, S.C. He was 95. Mr. Milliken, a billionaire whose Milliken & Company was based in Spartanburg and was one of the largest textile and chemical firms in the
http://www.nytimes.com/2011/01/01/arts/television/01burton.html	Philip Burton Jr., 76, TV Director	Philip Burton Jr., who wrote, produced and directed award-winning television documentaries about the struggle for African-American equality and the inner workings of American government, died on Dec. 24 in Santa Barbara, Calif. He was 76 and lived in Ojai, Calif. The cause was Alzheimer's disease, his brother, Michael, said. During a career that
http://www.nytimes.com/2011/01/01/arts/01dutton.html	Denis Dutton, Philosopher, Dies at 66	Denis Dutton, a distinguished philosopher, writer and digital-media guru who founded Arts & Letters Daily, one of the first Web sites to exploit the Internet as a vehicle for meaningful intellectual exchange, died on Tuesday in Christchurch, New Zealand, where he lived. He was 66. The cause was prostate cancer, his son, Ben, said. An impassioned
http://www.nytimes.com/2011/01/01/sports/baseball/01van.html	Tom Vandergriff, 84; Brought Team to Texas	DALLAS (AP) -- Tom Vandergriff, the former mayor of Arlington, Tex., who 40 years ago helped lure the Washington Senators baseball team to Texas, where they became the Rangers, died Thursday in Fort Worth. He was 84. His death was confirmed by his son, Victor. Born in Carrollton, Tex., on Jan. 29, 1926, Mr. Vandergriff moved to Arlington when he
http://query.nytimes.com/gst/fullpage.html?res=9E07E3D61130F932A35752C0A9679D8B63	Bernie Wilson, 64, R&B Singer	PHILADELPHIA (AP) -- Bernie Wilson, who sang baritone for Harold Melvin and the Blue Notes, died Sunday in Voorhees, N.J. He was 64. He died after suffering a stroke and a heart attack, his cousin Faith Peace-Mazzccua said. Philadelphia International Records, the record company for which Harold Melvin and the Blue Notes recorded ''If You Don't Know
http://www.nytimes.com/2010/12/31/world/europe/31caro.html	Isabelle Caro, Anorexic Model, Dies at 28	Isabelle Caro, a French model and actress who became the international face of anorexia when she allowed her ravaged body to be photographed nude for an Italian advertising campaign to raise awareness about the disease, died on Nov. 17. She was 28. Her friends and family initially kept her death secret. Danile Gouzard-Dubreuil-Prevot, Ms. Caro's
http://query.nytimes.com/gst/fullpage.html?res=9906E7D81739F932A05751C1A9669D8B63	Agathe von Trapp, 97, Eldest of Trapp Family Singers	HAGERSTOWN, Md. (The Associated Press) -- Agathe von Trapp, a member of the singing family whose escape from Nazi-occupied Austria was the basis for ''The Sound of Music,'' died in Towson, Md., on Tuesday. She was 97. She died in a hospice after suffering congestive heart failure in November, said her longtime friend Mary Louise Kane, with whom she
http://www.nytimes.com/2010/12/31/arts/design/31calle.html	Paul Calle, 82, Illustrator Of Thumb-Tip-Size Artwork	Paul Calle, a commercial artist whose most famous work was no bigger than a postage stamp, died on Thursday in Stamford, Conn. Mr. Calle, one of the most highly regarded stamp designers in the nation, was 82. The cause was melanoma, said his son Chris, who is also a stamp designer. A longtime Stamford resident, Mr. Calle (pronounced KAL-ee)
http://www.nytimes.com/2010/12/30/us/30doyle.html	Geraldine Doyle, 86, Iconic Face of World War II	Geraldine Hoff Doyle, who was believed to be the unwitting model for the ''We Can Do It!'' poster of a woman flexing her biceps in a factory during World War II -- an image that later became a symbol for the American feminist movement -- died on Sunday in Lansing, Mich. She was 86. The cause was complications of arthritis, said her daughter
http://www.nytimes.com/2010/12/30/business/30macauley.html	Robert Macauley, 87, Dies; Began Charity	Robert C. Macauley, a paper manufacturer whose charity delivered more than $10 billion in medicine, food and humanitarian aid to alleviate crises in more than 140 countries, died on Sunday at his home in North Palm Beach, Fla. He was 87. The cause was emphysema, Donna Porstner, a spokeswoman for AmeriCares, said. The idea for AmeriCares took shape
http://www.nytimes.com/2010/12/30/business/30garfield.html	Eugene Garfield, 74, Founder Of the Auto-Train Service	Eugene K. Garfield, who originated the American Auto-Train, ferrying passengers and their cars between Virginia and Florida, saving people the effort of driving to their winter vacation homes and the expense of renting cars when they got there, died in Hollywood, Fla., on Sunday. He was 74. The cause was esophageal cancer, said Brenda Brush, his
http://www.nytimes.com/2010/12/30/arts/music/30taylor.html	Billy Taylor, Jazz Pianist, Dies at 89	Billy Taylor, a pianist and composer who was also an eloquent spokesman and advocate for jazz as well as a familiar presence for many years on television and radio, died on Tuesday in Manhattan. He was 89 and lived in the Riverdale section of the Bronx. The cause was heart failure, said his daughter, Kim Taylor-Thompson. Dr. Taylor, as he preferred
http://query.nytimes.com/gst/fullpage.html?res=9403E1DF1E30F933A05751C1A9669D8B63	Frances Ginsberg, 55, Singer With New York City Opera	Frances Ginsberg, an American soprano heard regularly with the New York City Opera in the 1980s, died on Friday in the Bronx. She was 55 and had lived in Manhattan and Milan. The cause was brain and spinal cancer, said, Hagai Kamil, a longtime friend. Ms. Ginsberg had previously been treated for breast and ovarian cancer. Known for her large,
http://www.nytimes.com/2010/12/29/world/asia/29smith.html	E. Gene Smith, Who Helped to Save Tibetan Literary Canon, Dies at 74	E. Gene Smith, a Utah native who through persistence, ardor and benevolent guile amassed the largest collection of Tibetan books outside Tibet, saving them from isolation and destruction and making them accessible to scholars and Tibetan exiles around the world, died on Dec. 16 at his home in Manhattan. He was 74. The cause was not known, but Mr.
http://www.nytimes.com/2010/12/29/arts/design/29warhola.html	John Warhola, 85, Brother of Andy Warhol	John Warhola, an older brother of the Pop artist Andy Warhol and one of the original three trustees of the Andy Warhol Foundation for the Visual Arts, died on Friday in Pittsburgh. He was 85 and lived in Freedom, Pa. The cause was complications of pneumonia, his son Jeffrey said. Although Mr. Warhola was only three years older than Andy, the
http://www.nytimes.com/2010/12/29/business/29kahn.html	Alfred E. Kahn, 93, Dies; Led Airline Deregulation	Alfred E. Kahn, a Cornell University economist best known as the chief architect and promoter of deregulating the nation's airlines, despite opposition from industry executives and unions alike, died Monday at his home in Ithaca, N.Y. He was 93. The cause was cancer, Cornell said in a statement. Mr. Kahn, a leading regulatory scholar who wielded
http://www.nytimes.com/2010/12/29/arts/music/29ginsberg.html	Frances Ginsberg, American Soprano, Dies at 55	Frances Ginsberg, an American soprano heard regularly with the New York City Opera in the 1980s, died on Friday in the Bronx. She was 55 and had lived in Manhattan and Milan. The cause was brain and spinal cancer, said, Hagai Kamil, a longtime friend. Ms. Ginsberg had previously been treated for breast and ovarian cancer. Known for her large,
http://www.nytimes.com/2010/12/28/arts/music/28marie.html	Teena Marie, an R&B Hitmaker, Is Dead at 54	Teena Marie, a singer whose funky hits in the 1980s, like ''Lovergirl'' and ''Square Biz,'' made her one of the few white performers to consistently find success on the rhythm-and-blues charts, died on Sunday at her home in Pasadena, Calif. She was 54. The cause was not immediately known, but The Associated Press reported that the authorities said
http://query.nytimes.com/gst/fullpage.html?res=9900E4D61E30F93BA15751C1A9669D8B63	Steven W. Fisher	Steven W. Fisher, a New York State justice who presided over the trial of two men who killed five employees of a Wendy's fast food restaurant in Queens in 2000, died on Dec. 18 at his home in Queens. He was 64. The cause was lung cancer, his son-in-law, David Kerpen, said. Justice Fisher was the last judge in New York to impose the death penalty,
