http://www.nytimes.com/2011/06/25/arts/gene-colan-comic-book-artist-dies-at-84.html	Gene Colan, Prolific Comic-Book Artist, Dies at 84	Gene Colan, a towering figure among comic-book artists, whose depictions of some of the best-known characters in the genre were lauded for their realism, expressiveness and painterly qualities, died on Thursday in the Bronx. He was 84 and lived in Brooklyn. The cause was complications of cancer and liver disease, his son, Erik, said. Most closely
http://www.nytimes.com/2011/06/25/arts/don-diamond-character-actor-is-dead-at-90.html	Don Diamond, 90, TV Actor	Don Diamond, a character actor on radio, television and film who was best known for playing supporting roles on TV westerns, died on Sunday en route to a hospital in Los Angeles. He was 90. The cause was heart failure, his wife, Louisa, said. Mr. Diamond, a New Yorker of Russian Jewish heritage, often played ethnic minorities because he had
http://www.nytimes.com/2011/06/25/arts/television/peter-falk-columbo-actor-dies-at-83.html	Peter Falk, Rumpled and Crafty Actor In Television's 'Columbo,' Dies at 83	Peter Falk, who marshaled actorly tics, prop room appurtenances and his own physical idiosyncrasies to personify Columbo, one of the most famous and beloved fictional detectives in television history, died on Thursday night at his home in Beverly Hills, Calif. He was 83. His death was announced in a statement from Larry Larson, a longtime friend
http://www.nytimes.com/2011/06/25/nyregion/f-gilman-spencer-ny-daily-news-editor-in-the-80s-dies-at-85.html	F. Gilman Spencer, 85, Newspaper Editor	F. Gilman Spencer, who was known for his freewheeling style and sharp eye for writing talent as the editor of four newspapers, including The Philadelphia Daily News and The Daily News in New York, died on Friday in Manhattan. He was 85. The death was confirmed by his son F. Gilman Spencer IV. Mr. Spencer, known as Gil, worked in the newspaper
http://www.nytimes.com/2011/06/24/world/africa/24asmal.html	Kader Asmal, 76; Fought Apartheid	JOHANNESBURG (AP) -- Kader Asmal, a prominent member of South Africa's governing African National Congress who pressed his party to keep its democratic promises, died on Wednesday. He was 76. The party said in a statement that Mr. Asmal died in a Cape Town hospital. No cause of death was given. Mr. Asmal led anti-apartheid protests as a high school
http://query.nytimes.com/gst/fullpage.html?res=9804E4DA1731F937A15755C0A9679D8B63	David Rayfiel, 87, Screenwriter for Sydney Pollack, Dies	David Rayfiel, a screenwriter who in a long creative relationship with the director Sydney Pollack and Robert Redford collaborated on many of their most successful films, including ''Three Days of the Condor,'' ''Out of Africa'' and ''The Way We Were, '' but usually chose to keep his work anonymous, died on Wednesday in Manhattan. He was 87. The
http://query.nytimes.com/gst/fullpage.html?res=9900E1D91731F937A15755C0A9679D8B63	George M. White, at 90; Refurbished Capitol Hill	George M. White, the architect who oversaw myriad federal projects on Capitol Hill, including the construction of the Hart Senate Office Building and the restoration of the old Supreme Court and Senate chambers in the United States Capitol itself, died Friday at his home in Bethesda, Md. He was 90. The cause was complications of Parkinson's
http://www.nytimes.com/2011/06/23/world/europe/23haw.html	Brian Haw; Demonstrator Against Wars Was 62	Brian Haw, who day after day and night after night for nearly a decade maintained a vigil outside Parliament in London to protest the wars in Iraq and Afghanistan, becoming an annoyance to some politicians and a stopping point for tour guides, died on Saturday. He was 62. Mr. Haw died in Germany, where he had been receiving treatment for lung
http://www.nytimes.com/2011/06/23/books/e-m-broner-jewish-feminist-writer-dies-at-83.html	E. M. Broner, Jewish Feminist, Dies at 83	E. M. Broner, a writer who explored the double marginalization of being Jewish and female, producing a body of fiction and nonfiction that placed her in the vanguard of Jewish feminist letters, died on Tuesday in Manhattan. She was 83. The cause was multiple organ failure as a result of an infection, her daughter Nahama said. Ms. Broner (her
http://query.nytimes.com/gst/fullpage.html?res=9C01EEDA113EF931A15755C0A9679D8B63	Zeke Sinicola, 82; All-American in Basketball	Zeke Sinicola, a schoolboy basketball legend in New York City who went on to become an all-American at Niagara University before joining the Fort Wayne Pistons of the National Basketball Association in the early 1950s, died on June 6 in Manhattan. He was 82. The cause was colon cancer, his brother, Joseph Sinicola, said. A 5-foot-10 point guard
http://www.nytimes.com/2011/06/22/arts/design/thomas-n-armstrong-iii-whitney-museum-chief-dies-at-78.html	Thomas N. Armstrong III, Museum Chief Who Once Led the Whitney, Dies at 78	Thomas N. Armstrong III, who greatly expanded the Whitney Museum of American Art's holdings when he was its director in the 1970s and '80s but whose ambitious plans for a museum addition aroused a firestorm of opposition that led to his dismissal, died on Monday in Manhattan. He was 78. The cause was cardiac arrest, his daughter Amory Armstrong
http://www.nytimes.com/2011/06/21/books/a-whitney-ellsworth-new-york-review-publisher-dies-at-75.html	A. Whitney Ellsworth, First Publisher of New York Review, Dies at 75	A. Whitney Ellsworth, who helped get The New York Review of Books up and running as its first publisher, a position he held for nearly 25 years, died Saturday at his home in Salisbury, Conn. He was 75. The cause was pancreatic cancer, his daughter Nina Ellsworth Sanger said. Mr. Ellsworth also served in the mid-1970s as chairman of Amnesty
http://www.nytimes.com/2011/06/21/arts/television/ryan-dunn-daredevil-comedian-of-jackass-dies-at-34.html	Ryan Dunn, 34, Daredevil Comedian	Ryan Dunn, a star of the ''Jackass'' television show and movies, which feature perilous stunts and gags that often run afoul of good taste, died early Monday when his car went off a road and crashed in woods in West Goshen Township, Pa. He was 34. A passenger, who has not been identified, also died in the crash, which occurred near Mr. Dunn's home
http://www.nytimes.com/2011/06/20/world/africa/20chiluba.html	Frederick Chiluba, Infamous Zambia Leader, Dies at 68	Frederick Chiluba, the first democratically elected president of Zambia, a man whose image as a defender of civil liberties was later tarnished by his efforts to suppress political opposition and accusations that he used millions of dollars of public money on his wardrobe and other extravagances, died Saturday in Lusaka. He was 68. He suffered from
http://query.nytimes.com/gst/fullpage.html?res=9507E7DE1E3EF933A15755C0A9679D8B63	Clarence Clemons, 69, Friend And Band Mate to Springsteen	Clarence Clemons, the saxophonist in Bruce Springsteen's E Street Band, whose jovial onstage manner, soul-rooted style and brotherly relationship with Mr. Springsteen made him one of rock's most beloved sidemen, died on Saturday at a hospital in Palm Beach, Fla. He was 69. The cause was complications of a stroke he suffered last Sunday at his home
http://www.nytimes.com/2011/06/20/world/europe/20bonner.html	Elena Bonner, Human-Rights Activist And Widow of Sakharov, Dies at 88	Elena G. Bonner, the Soviet dissident and human-rights campaigner who endured banishment and exile along with her husband, the dissident nuclear physicist Andrei D. Sakharov, died Saturday in Boston. She was 88. The cause was heart failure, said Edward Kline, a director of the Andrei Sakharov Foundation. He said Ms. Bonner had been in the hospital
http://query.nytimes.com/gst/fullpage.html?res=9503E1DB113EF933A15755C0A9679D8B63	Joseph Miller, 93, a Seller Of Upscale Equestrian Gear	Joseph Miller, who built his father's humble harness shop in Manhattan into one of the nation's largest suppliers of fashionable saddlery, riding apparel and other equestrian equipment, died on June 12 at his home in Manhattan. He was 93. His death was confirmed by his son Daniel. Mr. Miller was president and chief executive of the Miller Harness
http://www.nytimes.com/2011/06/20/us/20hosty.html	James P. Hosty, 86; Investigated Oswald	Special Agent James P. Hosty had a few dozen cases in his portfolio in October 1963 when his supervisor in the Dallas office of the F.B.I. handed him another. It was the well-thumbed file on a suspected communist agitator and possible spy named Lee Harvey Oswald. Mr. Hosty tried to find Oswald during two trips into the field in early November,
http://www.nytimes.com/2011/06/19/sports/jim-rodnunsky-cablecam-creator-dies-at-54.html	Jim Rodnunsky Dies at 54; Created Camera of Thrills	Jim Rodnunsky, whose film work above the Canadian ski slopes resulted in the Cablecam, a rope-mounted, remote-control camera system that provides overhead and rapid-moving shots for televised sporting events and films, died on June 10 at his home in Granada Hills, Calif. He was 54. The cause was brain cancer, said his wife, Lisa. Cablecam, a device
http://www.nytimes.com/2011/06/19/world/europe/19pemper.html	Mietek Pemper, 91, Camp Inmate Who Compiled Schindler's List	Mietek Pemper was doing his job as a secretary taking dictation. One day his boss, Amon Goeth, glanced out the window and saw that a worker did not have a full load of stones in his wheelbarrow. Mr. Goeth walked outside and shot the man to death, then returned to his desk and said, ''Where were we in the text?'' Mr. Goeth was commandant of the
http://www.nytimes.com/2011/06/19/nyregion/clarence-clemons-e-street-band-saxophonist-dies-at-69.html	Clarence Clemons, Springsteen's Soulful Sideman, Dies at 69	Clarence Clemons, the saxophonist in Bruce Springsteen's E Street Band, whose jovial onstage manner, soul-rooted style and brotherly relationship with Mr. Springsteen made him one of rock's most beloved sidemen, died on Saturday at a hospital in Palm Beach, Fla. He was 69. The cause was complications of a stroke he suffered last Sunday at his home
http://www.nytimes.com/2011/06/18/arts/music/wild-man-fischer-outsider-musician-dies-at-66.html	Wild Man Fischer, 66, Outsider Musician	Wild Man Fischer, a mentally ill street musician who became a darling of the pop music industry in the 1960s and as a result enjoyed four decades of strange, intermittent and often ill-fitting celebrity, died on Thursday in Los Angeles. He was 66. The cause was heart failure, said Josh Rubin, a filmmaker whose documentary portrait of Mr. Fischer,
http://www.nytimes.com/2011/06/18/us/18haast.html	Bill Haast, a Man Charmed by Snakes, Dies at 100	Bill Haast figured he had handled more than three million poisonous snakes over the years, and he had the hands to prove it. An eastern diamondback rattlesnake left one hand looking like a claw. A Malayan pit viper mangled an index finger. A cottonmouth bit a finger, which instantly turned black, prompting his wife to snip off the fingertip with
http://www.nytimes.com/2011/06/17/arts/television/bob-banner-an-early-tv-producer-dies-at-89.html	Bob Banner Dies at 89; Producer in TV's Infancy	Bob Banner, a producer during television's early years who encouraged Carol Burnett to open her show by answering questions and Dinah Shore to end hers by blowing a kiss, died on Wednesday at a retirement home in the Woodland Hills area of Los Angeles. He was 89. The cause was Parkinson's disease, his friend Stephen Pouliot said. Mr. Banner was
http://www.nytimes.com/2011/06/17/us/17brown.html	Marion Fuller Brown, 94, Friend of Nature	Marion Fuller Brown, who as a state representative in Maine sponsored legislation that banned billboards throughout the state -- a law that was upheld by the United States Supreme Court -- died on June 3 at her farm in York, Me. She was 94. Her daughter Emily Fuller Hawkins confirmed her death. Mrs. Fuller Brown, who also was a founder of Scenic
http://www.nytimes.com/2011/06/16/books/kathryn-tucker-windham-southern-storyteller-dies-at-93.html	Kathryn T. Windham, 93, A Storyteller of the South	Kathryn Tucker Windham, who wove a tapestry of Southern folklore, bucolic scenes, reminiscences, cherished recipes and ghost stories through books and commentaries on public radio, died Sunday at her home in Selma, Ala. She was 93. Her friend Alvin Benn confirmed her death. Ms. Windham told tales of why she always paused until a buzzard flapped its
http://www.nytimes.com/2011/06/16/business/16haberman.html	Alan Haberman, Champion of a Symbol, Dies at 81	On a summer morning in 1974, a man in Ohio bought a package of chewing gum and the whole world changed. At 8:01 a.m. on June 26 of that year, a 10-pack of Wrigley's Juicy Fruit gum slid down a conveyor belt and past an optical scanner. The scanner beeped, and the cash register understood, faithfully ringing up 67 cents. That purchase, at a Marsh
http://www.nytimes.com/2011/06/15/nyregion/dr-james-rahal-infectious-disease-expert-dies-at-77.html	Dr. James J. Rahal, 77, Virus Expert, Dies	Dr. James J. Rahal, an infectious-disease specialist who raised early alarms about the rise of drug-resistant bacteria in hospitals, and who emerged as a leading expert in the treatment of West Nile virus after the Queens community where he worked became the epicenter of a deadly outbreak in 1999, died on Saturday in Manhattan. He was 77. The cause
http://www.nytimes.com/2011/06/15/us/15baldus.html	David C. Baldus, 75, Dies; Studied Race and the Law	David C. Baldus, whose pioneering research on race and the death penalty came within a vote of persuading the Supreme Court to make fundamental changes in the capital justice system, died on Monday at his home in Iowa City. He was 75. The cause was complications of colon cancer, his wife, Joyce C. Carman, said. Professor Baldus's work was at the
http://query.nytimes.com/gst/fullpage.html?res=950CE0DA163EF936A25755C0A9679D8B63	Zev Birger, 85, Revived Jerusalem Book Fair	JERUSALEM -- Zev Birger, an official in the young state of Israel who later revived and then led the Jerusalem International Book Fair, turning it into a major event on the literary calendar, died here on June 6 after being struck by a motorcycle. He was 85. Mr. Birger died of a head injury after being hit a few days earlier as he left a concert at
http://query.nytimes.com/gst/fullpage.html?res=9801E5D7113FF936A25755C0A9679D8B63	Edgar Tekere, 74, a Leader Of Zimbabwe Independence	JOHANNESBURG -- Edgar Z. Tekere, who was imprisoned for a decade with Robert Mugabe during the struggle to end white minority rule in Rhodesia, and later unsuccessfully challenged Mr. Mugabe's political domination of what had become an independent Zimbabwe, died on June 7 in the eastern city of Mutare, Zimbabwe. He was 74. The cause was prostate
http://query.nytimes.com/gst/fullpage.html?res=9C01EED8173EF936A25755C0A9679D8B63	Gunnar Fischer, 100, Cinematographer	Gunnar Fischer, a cinematographer whose use of stark lighting and sharp focus lent mood and psychological depth to a dozen of Ingmar Bergman's early films, including ''The Seventh Seal'' and ''Wild Strawberries,'' died on Saturday in Stockholm. He was 100. His death was confirmed by his son Jens. Mr. Fischer worked with Bergman for the first time
http://query.nytimes.com/gst/fullpage.html?res=9903E5DA123FF936A25755C0A9679D8B63	Wally Boag, Disneyland Cowboy Comedian, 90	Wally Boag , who for nearly 30 years and 40,000 performances delighted youngsters (and their parents) as Pecos Bill, the wide-eyed Old West traveling salesman in the Golden Horseshoe Revue at Disneyland, died on Friday in Santa Monica, Calif. He was 90. The cause was Alzheimer's disease, his son, Laurence, said. Under a very broad-brimmed cowboy
http://www.nytimes.com/2011/06/14/movies/laura-ziskin-behind-spider-man-films-dies-at-61.html	Laura Ziskin, Producer of 'Spider-Man' and 'Pretty Woman,' Dies at 61	LOS ANGELES -- Laura Ziskin, a prominent Hollywood producer who ventured into the largely male world of special-effects movies to become a shaping force behind the blockbuster ''Spider-Man'' franchise, died on Sunday at her home in Santa Monica, Calif. She was 61. The cause was complications of breast cancer, said Steve Elzer, a spokesman for Sony
http://www.nytimes.com/2011/06/14/arts/music/carl-gardner-lead-singer-of-coasters-dies-at-83.html	Carl Gardner, 83, Singer With Coasters Pop Group	Carl Gardner, the spunky tenor who was the lead singer of the original Coasters, whose mixture of rhythm-and-blues, doo-wop and sitcom humor created 1950s hits like ''Yakety Yak,'' ''Charlie Brown'' and ''Searchin,' '' died on Sunday in Port. St. Lucie, Fla. He was 83. The cause was congestive heart failure, his wife, Veta, said. She said he also
http://www.nytimes.com/2011/06/13/business/13greenland.html	Leo Greenland, Unconventional Adman Who Valued Truth-Telling, Dies at 91	Leo Greenland, an advertising executive known for a string of evocative campaigns of the late 20th century and for public advocacy of truthfulness in his profession, a faintly subversive stance on Madison Avenue at midcentury, died on June 4 in Manhattan. He was 91. Mr. Greenland, who had homes in Manhattan and Palm Beach Gardens, Fla., died of
http://www.nytimes.com/2011/06/13/arts/claudio-bravo-artist-who-blended-hyperrealism-and-classical-elements-dies-at-74.html	Claudio Bravo, Chilean Artist, Dies at 74	Claudio Bravo, a Chilean-born artist whose technically dazzling trompe-l'oeil paintings of paper-wrapped packages and draped cloth blended hyperrealism and classical Spanish influences , died on June 4 at his home in Taroudant, Morocco. He was 74. The cause was complications of epilepsy, David Robinson, the director of his New York gallery,
http://query.nytimes.com/gst/fullpage.html?res=9A0CEFDA163EF930A25755C0A9679D8B63	Dr. Irwin D. Mandel, 89, Dental Chemistry Expert	Millions of dental patients who have successfully avoided unpleasant drill-and-fill procedures owe much to Dr. Irwin D. Mandel -- an expert on dental chemistry jocularly known among colleagues as a leader of ''the Salivation Army.'' Dr. Mandel, a founder of the preventive dentistry movement who did research into the biochemistry of saliva that has
http://www.nytimes.com/2011/06/13/us/13hill.html	Maynard L. Hill, 85, Small-Scale Lindbergh	The comparison is irresistible. For his record-setting achievements in model airplaning -- or aeromodeling, in the parlance of hobbyists -- and especially for designing the first model of its kind to fly across the Atlantic Ocean, Maynard L. Hill was a Lindbergh in miniature. Little Lindy, if you will. In August 2003, his balsa-and-Mylar plane with
http://www.nytimes.com/2011/06/13/world/middleeast/13birger.html	Zev Birger, Jerusalem Book Fair Leader, Dies at 85	JERUSALEM -- Zev Birger, an official in the young state of Israel who later revived and then led the Jerusalem International Book Fair, turning it into a major event on the literary calendar, died here on June 6 after being struck by a motorcycle. He was 85. Mr. Birger died of a head injury after being hit a few days earlier as he left a concert at
http://www.nytimes.com/2011/06/13/arts/music/martin-rushent-record-producer-dead-at-62.html	Martin Rushent, 62, Versatile Record Producer	Martin Rushent, a prolific record producer who helped define the sound of British rock in the late 1970s and early '80s, died on June 4 at his home in Berkshire, England. He was 62. His death was confirmed by his son James. No cause was specified. Born in the Enfield borough of London on July 11, 1948, Mr. Rushent began his career as a recording
http://www.nytimes.com/2011/06/12/nyregion/gus-tyler-firebrand-of-labor-movement-dies-at-99.html	Gus Tyler, 99, Firebrand Of Trade Union Movement	Gus Tyler could recite word for word the first firebrand speech he gave more than 80 years ago on a soapbox on the Lower East Side. That long-ago youth tingled with the revolutionary promise he saw on the teeming streets of New York, in the new Soviet Union, in the great books he devoured, in the endless nocturnal debates. He tumbled through life
http://query.nytimes.com/gst/fullpage.html?res=9D06E6D91E3FF931A25755C0A9679D8B63	Jorge Semprn, Novelist and Activist, Dies at 87	Jorge Semprn, a Spanish writer whose novelistic memoirs (or memoirish novels) drew on his experiences as a French Resistance fighter, concentration camp survivor, Communist organizer and Communist dissident, and who wrote distinguished screenplays for Alain Resnais, Costa-Gavras, Joseph Losey and other directors, died on Tuesday at his home in
http://query.nytimes.com/gst/fullpage.html?res=9C00EEDF143EF931A25755C0A9679D8B63	John R. Alison, 98, Ace Fighter Pilot in World War II, Dies	John R. Alison, an ace fighter pilot in World War II who helped organize and lead a broad American air campaign that enabled British forces to bog down the Japanese in the jungles of Burma, died Monday at his home in Washington. He was 98. His son David confirmed his death. Mr. Alison, a retired Air Force Reserve major general, was a lieutenant
http://www.nytimes.com/2011/06/12/us/12luper.html	Clara Luper, 88, a Leader Of Sit-Ins for Civil Rights	Her name does not resonate like that of Rosa Parks, and she did not garner the kind of national attention that a group of black students did when they took seats at a Woolworth's lunch counter in Greensboro, N.C., in February 1960. But Clara Luper was a seminal figure in the sit-ins of the civil rights movement. Ms. Luper, who led one of the first
http://www.nytimes.com/2011/06/11/books/patrick-leigh-fermor-travel-writer-dies-at-96.html	Patrick Leigh Fermor, Travel Writer, Dies at 96	Patrick Leigh Fermor, the British writer whose erudite, high-spirited accounts of his adventures in prewar Europe, southern Greece and the Caribbean are widely regarded as classics of travel literature, died on Friday at his home in Worcestershire, England. He was 96. Roland Philipps, Mr. Leigh Fermor's editor at John Murray Publishers in Britain,
http://www.nytimes.com/2011/06/11/business/global/11lenihan.html	Brian Lenihan, 52, Official Who Led Ireland's Bailout	LONDON -- Brian Lenihan, who as Ireland's finance minister led the nation's effort to fend off bankruptcy during the worldwide economic collapse, died on Friday at his home in Dublin. He was 52. The cause was pancreatic cancer, said Adam Ledwith, a spokesman for the Fianna Fail political party. Mr. Lenihan had been treated for the disease since
http://www.nytimes.com/2011/06/11/education/11redlich.html	Norman Redlich, 85, Ex-Dean of N.Y.U. Law School	Norman Redlich, a quiet luminary of the New York legal community who pioneered the pro bono defense of indigent death row inmates and who, as a staff member of the Warren Commission, helped develop the so-called single-bullet theory to explain how President John F. Kennedy was killed by a lone gunman, died Friday at his home in Manhattan. He was
http://query.nytimes.com/gst/fullpage.html?res=9503E7DC103FF933A25755C0A9679D8B63	Jose Pagan, 76, Star of '71 Series	PITTSBURGH (AP) -- Jose Pagan, a former major leaguer who drove in the eventual winning run for Pittsburgh in Game 7 of the 1971 World Series, died on Tuesday at his home in Sebring, Fla. He was 76. His death was announced by the Pirates, who did not provide a cause. Pagan, a native of Puerto Rico, broke into the majors with the Giants in 1959 and
http://www.nytimes.com/2011/06/10/arts/design/maqbool-fida-husain-indias-most-famous-painter-dies-at-95.html	Maqbool Fida Husain, Indian Painter, Dies at 95	Maqbool Fida Husain, an artist whose modernist reinterpretations of mythic and religious subjects made him India's most famous painter and, in recent years, a target of right-wing Hindu groups, died on Thursday in London. He was 95. The cause was a heart attack, The Press Trust of India said, citing family members. Mr. Husain, who developed his
http://www.nytimes.com/2011/06/10/business/10sinfelt.html	John Sinfelt, 80, a Pioneer in Unleaded Gas	John H. Sinfelt, a chemical engineer whose research for an oil company helped lead to the introduction of unleaded gasoline and significant reductions in air pollution, died on May 28 in Morristown, N.J. He was 80. The cause was complications of congestive heart failure, his son, Klaus, said. In the late 1960s and '70s, the petroleum industry was
http://www.nytimes.com/2011/06/10/arts/television/leonard-b-stern-creator-of-mad-libs-dies-at-88.html	Leonard B. Stern, 88, a Creator of Mad Libs	Leonard B. Stern, an Emmy-winning writer, producer and director for television whose frantic search for an adjective one day led him and a colleague to create Mad Libs, the game that asks players to fill in blanks with designated parts of speech to yield comically ----------------[adj.] stories, died on Tuesday at his home in Beverly Hills, Calif.
http://www.nytimes.com/2011/06/10/sports/baseball/jim-northrup-detroit-tigers-outfielder-dies-at-71.html	Jim Northrup Dies at 71; Propelled Tigers to Title	DETROIT (AP) -- Jim Northrup, the outfielder who hit a decisive two-run triple in Game 7 of the 1968 World Series against the St. Louis Cardinals, propelling the Detroit Tigers to their first championship since 1945, died on Wednesday in Grand Blanc, Mich. He was 71. A friend, Bill Wischman, said Northrup had been in poor health for some time and
http://www.nytimes.com/2011/06/09/sports/genaro-hernandez-twice-a-world-champion-dies-at-45.html	Genaro Hernandez, 45, Twice a World Champion	Genaro Hernandez, a prizefighter nicknamed Chicanito -- roughly translated as Little Mexican -- who was twice the world super featherweight champion, died Tuesday at his home in Mission Viejo, Calif. He was 45. The cause was a rare cancer, called rhabdomyosarcoma, that attacks muscle fibers, his friend Bill Caplan said. Hernandez emerged from South
