http://www.nytimes.com/2011/11/14/us/h-gobind-khorana-1968-nobel-winner-for-rna-research-dies.html	H. Gobind Khorana, 89, Nobel-Winning Scientist, Dies	H. Gobind Khorana, who rose from a childhood of poverty in India to become a biochemist and share in a Nobel Prize for his role in deciphering the genetic code, died on Wednesday in Concord, Mass. He was 89. His death was announced by the Massachusetts Institute of Technology, where Dr. Khorana was a professor emeritus. Dr. Khorana, who received
http://query.nytimes.com/gst/fullpage.html?res=9906E1D9143FF930A25752C1A9679D8B63	Alan Mootnick, 60, Made a California Home for Gibbons	Alan Mootnick once said he felt a certain kinship with gibbons, a small, acrobatic and endangered member of the ape family. Like them, he said, ''I was lean, agile and comical.'' He acted on those feelings by making a Southern California home for the largest gathering of gibbons in the Western Hemisphere; going on ecological missions to their
http://www.nytimes.com/2011/11/13/arts/norton-dodge-84-economics-professor-and-art-collector-dies.html	Norton Dodge, 84, Dies; Stored Soviet Dissident Art	Norton Dodge, a genially rumpled economics professor who in the course of research trips to study arcana like tractors and workforce demographics managed quietly to amass the world's largest collection of nonconformist Soviet art, died on Nov. 5 in Washington. He was 84. The cause was multiple organ failure, his wife, Nancy, said. The couple had
http://query.nytimes.com/gst/fullpage.html?res=9A03E7DD153FF930A25752C1A9679D8B63	Lou Maletta, 74, Pioneer of Gay-Oriented TV Programming	Lou Maletta, who founded the Gay Cable Network in 1982, when the gay rights movement was not receiving broad media attention, died on Nov. 2 in Kingston, N.Y. He was 74. The cause was liver cancer, said Luke Valenti, his companion of 37 years. The network had its roots as a weekly program called ''Men & Film'' on Channel 35 on Manhattan Cable
http://www.nytimes.com/2011/11/13/world/asia/robert-a-scalapino-scholar-of-asian-politics-dies-at-92.html	Robert A. Scalapino, 92, A Scholar of Asian Politics	Robert A. Scalapino, an eminent scholar of Asian politics who achieved prominence during the Vietnam War for his strong defense of American policy as opposition to it was growing, died Nov. 1 in Oakland, Calif. He was 92. The cause was complications of a respiratory infection, the University of California, Berkeley, said. Professor Scalapino taught
http://www.nytimes.com/2011/11/13/nyregion/evelyn-h-lauder-champion-of-breast-cancer-research-dies-at-75.html	Evelyn Lauder, Cancer Research Advocate, Dies at 75	Evelyn H. Lauder, a refugee of Nazi-occupied Europe who married into an illustrious family in the beauty business and became an ardent advocate for breast cancer awareness, raising millions for research, died on Saturday at her home in Manhattan. She was 75. The cause was nongenetic ovarian cancer, said Alexandra Trower, a spokeswoman for the
http://www.nytimes.com/2011/11/12/us/henry-d-owen-diplomat-of-economic-summits-dies-at-91.html	Henry D. Owen, 91, Dies; Shaped Global Fiscal Order	Henry D. Owen, an influential diplomat who helped institutionalize global economic summitry in the 1970s and who was considered an intellectual framer of the elite round table known as the Trilateral Commission, died on Nov. 5 in Washington. He was 91. His death was confirmed by his son Chris. Mr. Owen worked in the State Department as an economic
http://www.nytimes.com/2011/11/12/arts/dance/annabelle-lyon-dancer-with-balanchine-dies-at-95.html	Annabelle Lyon, 95, Dancer for Balanchine	Annabelle Lyon, an American ballerina who danced with some of the most important companies in the formative years of 20th-century American ballet, died on Nov. 4 at her home in Mansfield, Mass. She was 95. Her death was confirmed by her son, Joshua Borah. Ms. Lyon joined the American Ballet, George Balanchine's first American company, in 1935 and
http://query.nytimes.com/gst/fullpage.html?res=9A04EEDD123FF931A25752C1A9679D8B63	Ed Pauls, 80; Developed An Indoor Skiing Machine	Ed Pauls, whose frustration at running on ice-slick Minnesota roads led him to develop the cross-country skiing simulator known as the NordicTrack, died on Oct. 9 at his home in Montrose, Colo. He was 80. The cause was Alzheimer's disease, his daughter, Terri, said. Patented in 1976, the NordicTrack, with its sliding wooden boards that imitate the
http://query.nytimes.com/gst/fullpage.html?res=9905E0DF153FF932A25752C1A9679D8B63	Ed Macauley, 83, N.B.A. Star of the '50's	Ed Macauley was voted the national college basketball player of the year in 1949 and the most valuable player in the N.B.A.'s first All-Star Game in 1951. The second-highest-paid player in the N.B.A. in the early 1950s, he made the all-star team in 7 of his 10 pro seasons. But perhaps he made his greatest impact on basketball history by being
http://query.nytimes.com/gst/fullpage.html?res=9F05E5D7163FF932A25752C1A9679D8B63	Margaret Field, 89, Actress	Margaret Field, an actress who appeared in countless television shows in the 1950s and '60s and who was the mother of the Academy Award winner Sally Field, died on Sunday at her home in Malibu, Calif. She was 89. The cause was cancer, Sally Field's publicist said. Margaret Field won a Paramount contract in the mid-1940s and initially appeared
http://www.nytimes.com/2011/11/10/business/media/bil-keane-creator-of-the-family-circus-dies-at-89.html	Bil Keane, Creator of 'The Family Circus,' Dies at 89	In the single-panel cartoon that Bil Keane drew for publication on Sept. 10, 1964, the mother is looking at the shopping list posted on the kitchen wall. In her handwriting are the words: ''Cereal, tea, soap.'' Following on the list, in sloppy kid's scrawl: ''Ice cream, cookies, plastic soldiers'' -- with all the S's reversed. In the cartoon
http://www.nytimes.com/2011/11/10/health/david-utz-surgeon-who-removed-reagans-prostate-dies-at-87.html	Dr. David C. Utz, 87; Surgeon Operated on Reagan	Dr. David C. Utz, a prominent urological surgeon at the Mayo Clinic who drew wide attention when he performed prostate surgery on President Ronald Reagan in 1987, died on Oct. 30 in Scottsdale, Ariz. He was 87. The cause was congestive heart failure, his son William said. As head of Mayo's urology department, Dr. Utz (pronounced yoots) operated on
http://www.nytimes.com/2011/11/10/business/media/hal-bruno-director-of-election-coverage-at-abc-dies-at-83.html	Hal Bruno, 83, a Specialist In ABC's Election Coverage	Hal Bruno, who helped shape political coverage at ABC News for nearly two decades and was a frequent analyst on its radio and television broadcasts, died on Tuesday, Election Day, in Bethesda, Md. He was 83. The cause was heart arrhythmia after a fall, his son Harold III said. Mr. Bruno, who lived in Chevy Chase, Md., began his journalism career as
http://www.nytimes.com/2011/11/09/arts/music/heavy-d-rap-star-dies-at-44.html	Heavy D, 44, Smooth-Talking Hip-Hop Star	Heavy D, the smooth-talking and cheerful rapper who billed himself as ''the overweight lover M.C.,'' died in Los Angeles on Tuesday. He was 44. The Los Angeles County coroner's office confirmed the death Tuesday evening, saying that Heavy D had collapsed at his home and was taken to Cedars-Sinai Medical Center, where he died shortly after noon. The
http://www.nytimes.com/2011/11/09/arts/television/hal-kanter-a-creator-of-julia-series-on-tv-dies-at-92.html	Hal Kanter, Television Writer, Dies at 92	Hal Kanter, an Emmy-winning comedy writer, director and producer known for creating ''Julia,'' the first television series to center on the life of a black professional woman, died on Sunday in Encino, Calif. He was 92. His death was announced by the Writers Guild of America, West. Mr. Kanter was for decades part of a team of writers behind the
http://www.nytimes.com/2011/11/08/sports/joe-frazier-ex-heavyweight-champ-dies-at-67.html	Joe Frazier, 1944-2011: Relentless Champion of the 'Fight of the Century'	Joe Frazier, the former heavyweight champion whose furious and intensely personal fights with a taunting Muhammad Ali endure as an epic rivalry in boxing history, died Monday night. He was 67. His business representative, Leslie Wolff, told The Associated Press on Saturday that Frazier had liver cancer and that he had entered hospice care. Known as
http://query.nytimes.com/gst/fullpage.html?res=9B03E7DB1F3CF93BA35752C1A9679D8B63	Sid Melton, 94, Comic Actor Of Television and Film Roles	Sid Melton, a jug-eared character actor best known for his regular roles in the television shows ''Green Acres'' and ''The Danny Thomas Show'' and for his unflagging reliability as the comic relief in many science fiction and noir films of the 1950s, died on Wednesday in Burbank, Calif. He was 94. His death was confirmed by a spokesman for
http://www.nytimes.com/2011/11/08/arts/theadora-van-runkle-costume-designer-dies-at-83.html	Theadora Van Runkle, Costume Designer, Is Dead at 83	Theadora Van Runkle, a self-taught costume designer who earned an Oscar nomination for her first picture, ''Bonnie and Clyde,'' and whose signature outfit for Faye Dunaway's Bonnie Parker -- beret, calf-length skirt and sweater -- ignited a fashion trend on the film's release in 1967, died on Friday in Los Angeles. She was 83. The cause was lung
http://query.nytimes.com/gst/fullpage.html?res=9400E4D8133CF934A35752C1A9679D8B63	ON THE RUNWAY; Loulou de la Falaise, 64, Designer and Muse	Loulou de la Falaise, a muse to Yves Saint Laurent who was also a designer and a woman whose style resisted classification, died on Saturday at her home in the Vexin region of northwest France. She was 64. Her death was announced by the Pierre Berge-Yves Saint Laurent Foundation, which did not give a cause. Ms. de la Falaise was synonymous with the
http://www.nytimes.com/2011/11/07/us/norman-ramsey-dies-at-96-work-led-to-the-atomic-clock.html	Norman Ramsey, 96, Dies; Work Led to Atomic Clock	Norman F. Ramsey, the Nobel Prize-winning physicist who developed a precise method to probe the structure of atoms and molecules and used it to devise a remarkably exact way to keep time, died on Friday in Wayland, Mass. He was 96. His death was confirmed by his wife, Ellie. In 1949, Dr. Ramsey invented an experimental technique to measure the
http://www.nytimes.com/2011/11/07/theater/phyllis-love-rosa-in-rose-tattoo-dies-at-85.html	Phyllis Love, 85, Actress on Broadway Stage	Phyllis Love, who often played ingnues on Broadway in the 1950s and who originated the part of Rosa Delle Rose in Tennessee Williams's ''Rose Tattoo,'' died on Oct. 30 at her home in Menifee, Calif. She was 85. The cause was complications of Alzheimer's disease, her husband, Alan Paul Gooding, said. Ms. Love made her debut on Broadway in 1950 as
http://www.nytimes.com/2011/11/06/arts/allen-mandelbaum-translator-of-divine-comedy-dies-at-85.html	Allen Mandelbaum, 85, Translator of Italian Poetry	Allen Mandelbaum, whose fluid, sensitive English version of Dante's ''Divine Comedy'' stamped his reputation as one of the world's premier translators of Italian and classical poetry, died on Oct. 27 in Winston-Salem, N.C. He was 85. His son, Jonathan, said he died after a long illness. Mr. Mandelbaum was well known for his translations of the
http://www.nytimes.com/2011/11/06/us/andy-rooney-mainstay-on-60-minutes-dead-at-92.html	Andy Rooney, a Cranky Voice of CBS, Dies at 92	Andy Rooney, whose prickly wit was long a mainstay of CBS News and whose homespun commentary on ''60 Minutes,'' delivered every week from 1978 until 2011, made him a household name, died on Friday in New York City. He was 92 and lived in Manhattan, though he kept a family vacation home in Rensselaerville, N.Y., and the first home he ever bought, in
http://www.nytimes.com/2011/11/06/us/dr-john-f-burke-dies-at-89-created-synthetic-skin.html	Dr. John F. Burke, 89; Created Synthetic Skin	Artificial skin had been the holy grail in treating burn victims for a century when Dr. John F. Burke began wrestling with some of the perennial obstacles to making it: finding a flexible material that would protect against infection and dehydration, that could be made from ordinary substances, that would not be rejected by a patient's immune
http://query.nytimes.com/gst/fullpage.html?res=9B04E2D9143CF935A35752C1A9679D8B63	Mary Hunt Kahlenberg, 71, Expert in Native Textiles	Mary Hunt Kahlenberg, a curator and collector of native textiles whose traveling exhibition on Navajo blankets, organized at the Los Angeles County Museum of Art in 1972, broke with tradition by presenting Navajo weaving as fine art, died on Oct. 27 at her home in Santa Fe. She was 71. The cause was carcinoid cancer, her husband, Robert T.
http://www.nytimes.com/2011/11/06/business/james-van-doren-dies-at-72-created-vans-canvas-shoes.html	James Van Doren, 72, Dies; Designer of Popular Shoes	James Van Doren, who designed the tenacious shoe that became a mainstay of California skateboard culture -- and which touched off a national fad after Sean Penn wore a black-and-white-checked pair in the movie ''Fast Times at Ridgemont High'' -- died on Oct. 12 at his home in Fullerton, Calif. He was 72. The cause was cancer, his wife, Char, said.
http://www.nytimes.com/2011/11/05/business/john-r-opel-who-made-ibm-a-colossus-dies-at-86.html	John R. Opel, Who Made I.B.M. a Colossus, Dies at 86	John R. Opel, who presided over I.B.M. in its final period of dominance in the information-processing industry and oversaw the company's move into personal computers, died on Thursday in Fort Myers, Fla. He was 86. His death was confirmed by Jeff Wickham, a son-in-law, who declined to disclose the cause. Mr. Opel (pronounced OH-pel) joined I.B.M.
http://www.nytimes.com/2011/11/05/arts/sam-fink-letterer-and-illustrator-of-historical-texts-dies-at-95.html	Sam Fink, 95, Letterer and Illustrator of Historical Texts	Sam Fink, a calligrapher who in a series of books reverentially inscribed the precise texts of four historical documents -- each a beacon of liberty -- and illustrated them with sometimes whimsical, often pungent drawings, died on Tuesday in Jerusalem. He was 95. The cause was kidney failure, said Natasha Fried, managing editor of Welcome Books,
http://www.nytimes.com/2011/11/05/sports/baseball/bob-forsch-former-cardinals-pitcher-dies-at-61.html	Cardinals' Bob Forsch, 61; Pitched in 3 World Series	Bob Forsch, who threw two no-hitters and won 163 games for St. Louis, more than any other Cardinals pitcher except the Hall of Famers Bob Gibson and Jesse Haines, died Thursday at his home near Tampa, Fla. He was 61. His death, which was reported on the Cardinals' Web site, came less than a week after Forsch threw the ceremonial first pitch before
http://www.nytimes.com/2011/11/05/arts/television/leonard-stone-character-actor-is-dead-at-87.html	Leonard Stone, 87, Actor in 'Willy Wonka'	Leonard Stone, a familiar character actor on television and in films who had a memorable turn as an overindulgent father in the 1971 movie ''Willy Wonka and the Chocolate Factory,'' died on Wednesday at his home in San Diego. He was 87. The cause was cancer, his granddaughter, Lindsey Fryman-Borchard, said. Mr. Stone's career of more than five
http://www.nytimes.com/2011/11/04/health/ricky-wyatt-57-dies-plaintiff-in-landmark-mental-care-suit.html	Ricky J. Wyatt, 57; Led Mental Care Suit	Ricky Wyatt was a rambunctious Alabama teenager who had broken windows, overturned a school desk or two, and been in and out of group homes. His probation officer decided he needed to be committed to a mental institution. His aunt, his legal guardian, agreed. So Ricky found himself at 14 in a crowded and understaffed hell, the Bryce State Hospital
http://query.nytimes.com/gst/fullpage.html?res=9800E3DA1E3DF937A35752C1A9679D8B63	Beryl Davis, 87, Singer With Big Bands	Beryl Davis, a British singer who was beloved in England for carrying on with her cabaret performances during the bombing of London in World War II, and who later performed with Frank Sinatra and the big bands of Benny Goodman and Glenn Miller, died on Friday in Los Angeles. She was 87. The cause was complications of Alzheimer's disease, said a
http://www.nytimes.com/2011/11/04/business/allen-j-bernstein-owner-of-mortons-steakhouses-dies-at-65.html	Allen Bernstein, 65, Owner of Steakhouse Chain	Allen J. Bernstein, who greatly expanded the high-end Morton's of Chicago steakhouse chain during his 17 years as chairman, applying what some in the industry called a Big Mac approach to filet mignon, died on Tuesday at a hospital near his home in Manhasset, N.Y., on Long Island. He was 65. He died after a long illness, his wife, Lori, said. Mr.
http://www.nytimes.com/2011/11/04/sports/baseball/matty-alou-batting-champion-for-pirates-dies-at-72.html	Matty Alou, Batting Champion for Pirates, Dies at 72	Matty Alou, a left-handed slap-hitting outfielder who won a batting championship as a Pittsburgh Pirate and who as a San Francisco Giant once shared an outfield with his brothers Felipe and Jess, has died in Santo Domingo, Dominican Republic. He was 72. A spokeswoman for the Giants, Staci Slaughter, confirmed the death, saying Alou had been ill
http://www.nytimes.com/2011/11/03/arts/television/jimmy-savile-tv-personality-dies-at-84.html	Jimmy Savile, TV Personality, Dies at 84	Jimmy Savile, an acclaimed English television host whose dress, hair and verbal flummery made all other comers in a nation renowned for eccentrics look like Puritans, was found dead last week at his home in Leeds, in the north of England. He was 84. A puckish man, he years ago erected a memorial bench to himself in Scarborough, also in the north,
http://www.nytimes.com/2011/11/03/sports/stanley-bergstein-harness-racing-hall-of-famer-dies-at-87.html	Stanley Bergstein, 87, Racing Executive	TUCSON (AP) -- Stanley Bergstein, a member of the Harness Racing Hall of Fame and the longtime leader of Harness Tracks of America, died on Wednesday at his home in Tucson. He was 87. The cause was heart failure, said Ken Weingartner, a spokesman for the United States Trotting Association. Besides his role as executive vice president of the harness
http://www.nytimes.com/2011/11/03/nyregion/yvonne-mccain-plaintiff-in-suit-on-homeless-families-dies-at-63.html	Yvonne McCain, 63, Plaintiff in Shelter Suit	Yvonne McCain, a once-homeless mother of four whose years of living in a fetid, ramshackle welfare hotel in Midtown Manhattan led to a landmark court ruling requiring the city to provide decent shelter for homeless families, died Saturday in her rent-subsidized, middle-income apartment on Staten Island. She was 63. The cause was cancer, her
http://www.nytimes.com/2011/11/03/arts/music/liz-anderson-who-wrote-hit-country-songs-dies-at-81.html	Liz Anderson, 81, Country Songwriter	Liz Anderson, who wrote breakthrough hits for Merle Haggard and other country singers and recorded songs of her own about faithless men and beleaguered women, died on Monday in Nashville. She was 81. The cause was complications of heart and lung disease, said her publicist, Pam Lewis. Ms. Anderson had early success as a songwriter while living in
http://www.nytimes.com/2011/11/02/us/dorothy-rodham-mother-of-hillary-clinton-dies-at-92.html	Dorothy Rodham, Mother and Mentor Of Hillary Clinton, Is Dead at 92	Dorothy Rodham, who overcame years of struggle to become a powerful influence on the life and career of her daughter, Hillary Rodham Clinton, the first lady, senator from New York, presidential candidate and now secretary of state, died on Tuesday in Washington. She was 92. Her family announced her death. Mrs. Clinton canceled a trip to London and
http://www.nytimes.com/2011/11/02/arts/tom-keith-creator-of-radio-soundscapes-dies-at-64.html	Tom Keith, 64, Creator Of Radio Soundscapes	For more than 30 years Tom Keith conjured animals, gunshots, screeching tires, even a man falling into piranha-infested waters, for a live national audience that reached nearly four million, using only his vocal cords and an array of props. A radio voice actor and a sound-effects master, he was an integral part of ''A Prairie Home Companion,'' the
http://www.nytimes.com/2011/11/02/movies/gilbert-cates-producer-of-oscar-shows-dies-at-77.html	Gilbert Cates, Producer Of Oscar Shows, Dies at 77	LOS ANGELES -- Gilbert Cates, a director and producer who shaped Hollywood's labor relations through the Directors Guild of America and its glamour scene through a record 14 Oscar telecasts, died here on Monday. He was 77. Mr. Cates apparently died in a parking lot at the University of California, Los Angeles, associates said. He was the producing
http://www.nytimes.com/2011/11/01/us/james-forrester-conservative-nc-lawmaker-is-dead-at-74.html	James Forrester, 74, Gay-Union Foe	RALEIGH, N.C. (AP) -- State Senator James Forrester, a physician and social conservative, died on Monday in Gastonia, N.C., just weeks after leading a successful fight to put a constitutional ban on same-sex marriage on the North Carolina ballot next spring. He was 74. His death was confirmed by his daughter Mary Paige Forrester. Mr. Forrester, a
http://www.nytimes.com/2011/11/01/sports/tom-mcneeley-contender-for-heavyweight-title-dies-at-74.html	Tom McNeeley, Challenger To Patterson, Is Dead at 74	Tom McNeeley, a knockout artist who challenged Floyd Patterson for the heavyweight championship in 1961, losing an action-packed four-round bout that featured at least nine knockdowns -- it depends how you count -- died on Oct. 25 in Weymouth, Mass. He was 74. The cause was complications of a seizure, his son Tom III said. McNeeley fought
http://www.nytimes.com/2011/11/01/health/joyce-clifford-who-pushed-for-primary-nursing-approach-dies-at-76.html	Joyce Clifford, 76; Led Changes in Nursing	Joyce C. Clifford, a nurse who advocated a partnership of equals between doctors and nurses in the treatment of patients, and whose ideas were adopted in some of the nation's best hospitals because they reduced medical errors and improved survival rates, died on Oct. 21 in Boston. She was 76. The cause was heart disease and kidney failure, said her
http://www.nytimes.com/2011/10/31/business/robert-a-pritzker-dies-at-85-family-conglomerate-included-hyatt.html	Robert A. Pritzker, 85; Led Family Business	Robert A. Pritzker, an industrial engineer and philanthropist who ran one of America's largest private companies, died Thursday in Chicago. He was 85. The cause was Parkinson's disease, said Louhon Tucker, an executive of Colson Associates, the company Mr. Pritzker led at the time of his death. Colson Associates had previously been part of the
http://www.nytimes.com/2011/10/31/world/europe/axel-axgil-danish-advocate-for-gay-rights-dies-at-96.html	Axel Axgil, 96, Danish Advocate for Gay Rights	COPENHAGEN (AP) -- Axel Axgil, whose struggle for gay rights helped make Denmark the first country to legalize same-sex partnerships, died here on Saturday. He was 96. The cause was complications from a fall, the Danish gay rights group LGBT Danmark said. In 1948 Mr. Axgil was a founder of that organization, one of the oldest gay rights groups in
http://www.nytimes.com/2011/10/31/arts/ruby-cohn-theater-scholar-and-beckett-authority-dies-at-89.html	Ruby Cohn, Writer and Expert on Beckett, Dies at 89	Ruby Cohn, a theater scholar who espied the genius of Samuel Beckett early on in Paris and became a leading authority on his work as well as his friend, died on Oct. 18 in Oakland, Calif. She was 89 and lived until recently in San Francisco. The cause was Parkinson's disease, her lawyer and friend, Sandy Springs, said in an e-mail. Ms. Cohn was for
http://www.nytimes.com/2011/10/30/business/bob-beaumont-who-popularized-electric-cars-dies-at-79.html	Bob Beaumont Dies at 79; Popularized Electric Cars	Bob Beaumont, who thought every home should have an affordable electric vehicle in its driveway and sold more than 2,000 of them, the tiny, trapezoidal creation known as the CitiCar, decades before General Motors and Nissan came up with their own versions, died on Monday at his home in Columbia, Md. He was 79. The cause was emphysema, said his
http://query.nytimes.com/gst/fullpage.html?res=9B0DE6D8143DF933A05753C1A9679D8B63	Florence Parry Heide, Children's Writer and Poet, Dies at 92	Florence Parry Heide, who wrote dozens of books of prose and poetry for children -- often enhanced with drawings by famed illustrators -- that enthralled the youngest readers (and those who read to them), has died at her home in Kenosha, Wis. She was 92. She died in her sleep either Sunday night, Oct. 23, or early Monday, said her daughter Roxanne
http://www.nytimes.com/2011/10/29/us/politics/ex-congressman-howard-wolpe-who-pushed-for-anti-apartheid-act-dies-at-71.html	Howard Wolpe, 71, Backer Of '86 Anti-Apartheid Act	Howard E. Wolpe, a former congressman who played a crucial role in passing legislation that imposed economic sanctions on South Africa in the 1980s, helping to bring an end to apartheid while overcoming two vetoes by President Ronald Reagan, died Tuesday at his home in Saugatuck, Mich. He was 71. His cousin Bruce Wolpe said the cause had not been
http://www.nytimes.com/2011/10/29/world/americas/rev-dean-brackley-65-dies-moved-to-el-salvador-after-massacre.html	Rev. Dean Brackley, 65, Dies; Served in El Salvador	The Rev. Dean Brackley belonged to an order of priests, the Jesuits, sometimes referred to as ''God's Marines,'' because of a 16th-century founder's military background and because of their long tradition of intellectual rigor as teachers and missionaries. Father Brackley, who died on Oct. 16 in El Salvador, imbued that nickname with some literal
